    1 2025-10-02 14:05:09.520554      0.0.0.0 → 255.255.255.255 DHCP 342 DHCP Request  - Transaction ID 0x751b2d81
    2 2025-10-02 14:05:09.597579 156.143.52.93 → 17.248.186.105 TLSv1.2 153 Application Data
    3 2025-10-02 14:05:09.609875 17.248.186.105 → 156.143.52.93 TCP 66 443 → 57859 [ACK] Seq=1 Ack=88 Win=355 Len=0 TSval=2941771174 TSecr=3222553908
    4 2025-10-02 14:05:09.609879 17.248.186.105 → 156.143.52.93 TLSv1.2 105 Application Data
    5 2025-10-02 14:05:09.610190 156.143.52.93 → 17.248.186.105 TCP 66 57859 → 443 [ACK] Seq=88 Ack=40 Win=3044 Len=0 TSval=3222553921 TSecr=2941771175
    6 2025-10-02 14:05:09.610794 17.248.186.105 → 156.143.52.93 TLSv1.2 136 Application Data
    7 2025-10-02 14:05:09.610947 156.143.52.93 → 17.248.186.105 TCP 66 57859 → 443 [ACK] Seq=88 Ack=110 Win=3043 Len=0 TSval=3222553921 TSecr=2941771175
    8 2025-10-02 14:05:09.724239 156.143.52.93 → 10.102.52.38 TCP 78 64829 → 7000 [SYN] Seq=0 Win=65535 Len=0 MSS=1460 WS=64 TSval=2471911678 TSecr=0 SACK_PERM
    9 2025-10-02 14:05:09.827529      0.0.0.0 → 255.255.255.255 DHCP 342 DHCP Request  - Transaction ID 0xc1991eb6
   10 2025-10-02 14:05:10.032661      0.0.0.0 → 255.255.255.255 DHCP 342 DHCP Request  - Transaction ID 0x5dada12
   11 2025-10-02 14:05:10.444474      0.0.0.0 → 255.255.255.255 DHCP 342 DHCP Request  - Transaction ID 0x3464971b
   12 2025-10-02 14:05:10.725068 156.143.52.93 → 10.102.52.38 TCP 78 [TCP Retransmission] 64829 → 7000 [SYN] Seq=0 Win=65535 Len=0 MSS=1460 WS=64 TSval=2471912679 TSecr=0 SACK_PERM
   13 2025-10-02 14:05:11.568801      0.0.0.0 → 255.255.255.255 DHCP 342 DHCP Request  - Transaction ID 0x3464971c
   14 2025-10-02 14:05:11.726291 156.143.52.93 → 10.102.52.38 TCP 78 [TCP Retransmission] 64829 → 7000 [SYN] Seq=0 Win=65535 Len=0 MSS=1460 WS=64 TSval=2471913681 TSecr=0 SACK_PERM
   15 2025-10-02 14:05:11.765029 156.143.52.93 → 18.97.36.18  TLSv1.2 308 Application Data
   16 2025-10-02 14:05:11.787728  18.97.36.18 → 156.143.52.93 TLSv1.2 184 Application Data
   17 2025-10-02 14:05:11.788235 156.143.52.93 → 18.97.36.18  TCP 66 57664 → 443 [ACK] Seq=243 Ack=119 Win=2047 Len=0 TSval=3722969937 TSecr=61831607
   18 2025-10-02 14:05:12.492009      0.0.0.0 → 255.255.255.255 DHCP 342 DHCP Request  - Transaction ID 0xad225240
   19 2025-10-02 14:05:12.727264 156.143.52.93 → 10.102.52.38 TCP 78 [TCP Retransmission] 64829 → 7000 [SYN] Seq=0 Win=65535 Len=0 MSS=1460 WS=64 TSval=2471914682 TSecr=0 SACK_PERM
   20 2025-10-02 14:05:12.899192      0.0.0.0 → 255.255.255.255 DHCP 342 DHCP Request  - Transaction ID 0x9ac50389
   21 2025-10-02 14:05:13.728540 156.143.52.93 → 10.102.52.38 TCP 78 [TCP Retransmission] 64829 → 7000 [SYN] Seq=0 Win=65535 Len=0 MSS=1460 WS=64 TSval=2471915683 TSecr=0 SACK_PERM
   22 2025-10-02 14:05:14.026185      0.0.0.0 → 255.255.255.255 DHCP 342 DHCP Request  - Transaction ID 0x85027f2a
   23 2025-10-02 14:05:14.729814 156.143.52.93 → 10.102.52.38 TCP 78 [TCP Retransmission] 64829 → 7000 [SYN] Seq=0 Win=65535 Len=0 MSS=1460 WS=64 TSval=2471916684 TSecr=0 SACK_PERM
   24 2025-10-02 14:05:14.845838      0.0.0.0 → 255.255.255.255 DHCP 342 DHCP Request  - Transaction ID 0x8bdbd22f
   25 2025-10-02 14:05:16.384140 140.82.114.26 → 156.143.52.93 TLSv1.2 92 Application Data
   26 2025-10-02 14:05:16.385004 156.143.52.93 → 140.82.114.26 TCP 66 57660 → 443 [ACK] Seq=1 Ack=27 Win=2048 Len=0 TSval=2801919498 TSecr=1373720070
   27 2025-10-02 14:05:16.385013 156.143.52.93 → 140.82.114.26 TLSv1.2 90 Application Data
   28 2025-10-02 14:05:16.385014 156.143.52.93 → 140.82.114.26 TLSv1.2 92 Application Data
   29 2025-10-02 14:05:16.385015 156.143.52.93 → 140.82.114.26 TLSv1.2 90 Application Data
   30 2025-10-02 14:05:16.412592 140.82.114.26 → 156.143.52.93 TCP 66 443 → 57660 [ACK] Seq=27 Ack=75 Win=70 Len=0 TSval=1373720146 TSecr=2801919498
   31 2025-10-02 14:05:16.730271 156.143.52.93 → 10.102.52.38 TCP 78 [TCP Retransmission] 64829 → 7000 [SYN] Seq=0 Win=65535 Len=0 MSS=1460 WS=64 TSval=2471918685 TSecr=0 SACK_PERM
   32 2025-10-02 14:05:16.790418      0.0.0.0 → 255.255.255.255 DHCP 342 DHCP Request  - Transaction ID 0x4d44812b
   33 2025-10-02 14:05:16.957717 156.143.52.93 → 10.102.52.38 TCP 78 64830 → 7000 [SYN] Seq=0 Win=65535 Len=0 MSS=1460 WS=64 TSval=3503796093 TSecr=0 SACK_PERM
   34 2025-10-02 14:05:17.011335 44.218.147.149 → 156.143.52.93 TLSv1.2 112 Application Data
   35 2025-10-02 14:05:17.011338 44.218.147.149 → 156.143.52.93 TLSv1.2 97 Encrypted Alert
   36 2025-10-02 14:05:17.011341 44.218.147.149 → 156.143.52.93 TCP 66 443 → 57873 [FIN, ACK] Seq=78 Ack=1 Win=425 Len=0 TSval=1241291335 TSecr=1234374402
   37 2025-10-02 14:05:17.011921 156.143.52.93 → 44.218.147.149 TCP 66 57873 → 443 [ACK] Seq=1 Ack=79 Win=2047 Len=0 TSval=1234434392 TSecr=1241291335
   38 2025-10-02 14:05:17.012652 156.143.52.93 → 44.218.147.149 TCP 54 57873 → 443 [RST, ACK] Seq=1 Ack=79 Win=2048 Len=0
   39 2025-10-02 14:05:17.715133 208.103.161.2 → 156.143.52.93 TLSv1.2 91 Application Data
   40 2025-10-02 14:05:17.715827 156.143.52.93 → 208.103.161.2 TCP 66 57548 → 443 [ACK] Seq=1 Ack=26 Win=2048 Len=0 TSval=1148430371 TSecr=348376903
   41 2025-10-02 14:05:17.717643 156.143.52.93 → 208.103.161.2 TLSv1.2 95 Application Data
   42 2025-10-02 14:05:17.727925 208.103.161.2 → 156.143.52.93 TCP 66 443 → 57548 [ACK] Seq=26 Ack=30 Win=16 Len=0 TSval=348376998 TSecr=1148430373
   43 2025-10-02 14:05:17.959010 156.143.52.93 → 10.102.52.38 TCP 78 [TCP Retransmission] 64830 → 7000 [SYN] Seq=0 Win=65535 Len=0 MSS=1460 WS=64 TSval=3503797094 TSecr=0 SACK_PERM
   44 2025-10-02 14:05:18.019733      0.0.0.0 → 255.255.255.255 DHCP 342 DHCP Request  - Transaction ID 0xd7c44cad
   45 2025-10-02 14:05:18.327136      0.0.0.0 → 255.255.255.255 DHCP 342 DHCP Request  - Transaction ID 0xf946eb0c
   46 2025-10-02 14:05:18.960238 156.143.52.93 → 10.102.52.38 TCP 78 [TCP Retransmission] 64830 → 7000 [SYN] Seq=0 Win=65535 Len=0 MSS=1460 WS=64 TSval=3503798096 TSecr=0 SACK_PERM
   47 2025-10-02 14:05:19.110816 17.248.186.105 → 156.143.52.93 TLSv1.2 167 Application Data
   48 2025-10-02 14:05:19.111391 156.143.52.93 → 17.248.186.105 TCP 66 57859 → 443 [ACK] Seq=88 Ack=211 Win=3042 Len=0 TSval=3222563422 TSecr=2941780676
   49 2025-10-02 14:05:19.113086 156.143.52.93 → 17.248.186.105 TLSv1.2 132 Application Data
   50 2025-10-02 14:05:19.162209 17.248.186.105 → 156.143.52.93 TCP 66 443 → 57859 [ACK] Seq=211 Ack=154 Win=355 Len=0 TSval=2941780727 TSecr=3222563424
   51 2025-10-02 14:05:19.250172      0.0.0.0 → 255.255.255.255 DHCP 342 DHCP Request  - Transaction ID 0x569b4ae0
   52 2025-10-02 14:05:19.250174      0.0.0.0 → 255.255.255.255 DHCP 342 DHCP Request  - Transaction ID 0x941fa95b
   53 2025-10-02 14:05:19.454617      0.0.0.0 → 255.255.255.255 DHCP 342 DHCP Request  - Transaction ID 0xf41bea15
   54 2025-10-02 14:05:19.961464 156.143.52.93 → 10.102.52.38 TCP 78 [TCP Retransmission] 64830 → 7000 [SYN] Seq=0 Win=65535 Len=0 MSS=1460 WS=64 TSval=3503799097 TSecr=0 SACK_PERM
   55 2025-10-02 14:05:20.170382      0.0.0.0 → 255.255.255.255 DHCP 342 DHCP Request  - Transaction ID 0x9654797b
   56 2025-10-02 14:05:20.272730 156.143.62.30 → 156.143.63.255 UDP 82 57621 → 57621 Len=40
   57 2025-10-02 14:05:20.579903      0.0.0.0 → 255.255.255.255 DHCP 342 DHCP Request  - Transaction ID 0x941fa95c
   58 2025-10-02 14:05:20.952402 156.143.52.93 → 13.107.213.41 TCP 54 64821 → 443 [ACK] Seq=1 Ack=1 Win=2048 Len=0
   59 2025-10-02 14:05:20.960073 13.107.213.41 → 156.143.52.93 TLSv1.2 105 [TCP ACKed unseen segment] , Application Data
   60 2025-10-02 14:05:20.960076 13.107.213.41 → 156.143.52.93 TLSv1.2 90 Application Data
   61 2025-10-02 14:05:20.960078 13.107.213.41 → 156.143.52.93 TCP 66 443 → 64821 [FIN, ACK] Seq=64 Ack=2 Win=108 Len=0 TSval=4032046800 TSecr=1300925939
   62 2025-10-02 14:05:20.960080 13.107.213.41 → 156.143.52.93 TCP 66 [TCP Retransmission] 443 → 64821 [FIN, ACK] Seq=64 Ack=2 Win=108 Len=0 TSval=4032046826 TSecr=1300925939
   63 2025-10-02 14:05:20.960330 156.143.52.93 → 13.107.213.41 TCP 66 [TCP Previous segment not captured] 64821 → 443 [ACK] Seq=2 Ack=64 Win=2048 Len=0 TSval=1301015960 TSecr=4032046799
   64 2025-10-02 14:05:20.960420 156.143.52.93 → 13.107.213.41 TCP 66 64821 → 443 [ACK] Seq=2 Ack=65 Win=2048 Len=0 TSval=1301015960 TSecr=4032046800
   65 2025-10-02 14:05:20.960452 156.143.52.93 → 13.107.213.41 TCP 66 [TCP Dup ACK 64#1] 64821 → 443 [ACK] Seq=2 Ack=65 Win=2048 Len=0 TSval=1301015960 TSecr=4032046800
   66 2025-10-02 14:05:20.960868 156.143.52.93 → 13.107.213.41 TCP 66 64821 → 443 [FIN, ACK] Seq=2 Ack=65 Win=2048 Len=0 TSval=1301015960 TSecr=4032046800
   67 2025-10-02 14:05:20.962532 156.143.52.93 → 10.102.52.38 TCP 78 [TCP Retransmission] 64830 → 7000 [SYN] Seq=0 Win=65535 Len=0 MSS=1460 WS=64 TSval=3503800098 TSecr=0 SACK_PERM
   68 2025-10-02 14:05:20.964531 13.107.213.41 → 156.143.52.93 TCP 66 [TCP Dup ACK 59#1] 443 → 64821 [ACK] Seq=65 Ack=2 Win=108 Len=0 TSval=4032046848 TSecr=1300925939
   69 2025-10-02 14:05:20.969655 13.107.213.41 → 156.143.52.93 TCP 66 443 → 64821 [ACK] Seq=65 Ack=3 Win=108 Len=0 TSval=4032046853 TSecr=1301015960
   70 2025-10-02 14:05:21.091776      0.0.0.0 → 255.255.255.255 DHCP 342 DHCP Request  - Transaction ID 0x179f7eb2
   71 2025-10-02 14:05:21.296770 fe80::c66e:7bff:fe64:e3c5 → ff02::fb     MDNS 139 Standard query 0x03d4 PTR _googlecast._tcp.local, "QM" question PTR _CC1AD845._sub._googlecast._tcp.local, "QM" question PTR _CC32E753._sub._googlecast._tcp.local, "QM" question
   72 2025-10-02 14:05:21.963472 156.143.52.93 → 10.102.52.38 TCP 78 [TCP Retransmission] 64830 → 7000 [SYN] Seq=0 Win=65535 Len=0 MSS=1460 WS=64 TSval=3503801099 TSecr=0 SACK_PERM
   73 2025-10-02 14:05:22.015814 Fortinet_d4:84:14 → e6:72:49:f1:ba:ae ARP 60 Who has 156.143.52.93? Tell 156.143.48.8
   74 2025-10-02 14:05:22.015969 e6:72:49:f1:ba:ae → Fortinet_d4:84:14 ARP 42 156.143.52.93 is at e6:72:49:f1:ba:ae
   75 2025-10-02 14:05:22.935155      0.0.0.0 → 255.255.255.255 DHCP 342 DHCP Request  - Transaction ID 0x68e69948
   76 2025-10-02 14:05:23.964722 156.143.52.93 → 10.102.52.38 TCP 78 [TCP Retransmission] 64830 → 7000 [SYN] Seq=0 Win=65535 Len=0 MSS=1460 WS=64 TSval=3503803100 TSecr=0 SACK_PERM
   77 2025-10-02 14:05:24.880792      0.0.0.0 → 255.255.255.255 DHCP 342 DHCP Request  - Transaction ID 0xe4102133
   78 2025-10-02 14:05:24.983170      0.0.0.0 → 255.255.255.255 DHCP 342 DHCP Discover - Transaction ID 0x860f9e7b
   79 2025-10-02 14:05:25.188268      0.0.0.0 → 255.255.255.255 DHCP 342 DHCP Request  - Transaction ID 0x173c2ed6
   80 2025-10-02 14:05:26.007144      0.0.0.0 → 255.255.255.255 DHCP 342 DHCP Request  - Transaction ID 0xf12fa245
   81 2025-10-02 14:05:26.109542      0.0.0.0 → 255.255.255.255 DHCP 342 DHCP Request  - Transaction ID 0x860f9e7b
   82 2025-10-02 14:05:26.522285 208.103.161.2 → 156.143.52.93 TLSv1.2 120 Application Data
   83 2025-10-02 14:05:26.522916 156.143.52.93 → 208.103.161.2 TCP 66 57548 → 443 [ACK] Seq=30 Ack=80 Win=2048 Len=0 TSval=1148439178 TSecr=348385729
   84 2025-10-02 14:05:26.524945 156.143.52.93 → 208.103.161.2 TLSv1.2 124 Application Data
   85 2025-10-02 14:05:26.533435 208.103.161.2 → 156.143.52.93 TCP 66 443 → 57548 [ACK] Seq=80 Ack=88 Win=16 Len=0 TSval=348385804 TSecr=1148439181
   86 2025-10-02 14:05:27.031473      0.0.0.0 → 255.255.255.255 DHCP 342 DHCP Request  - Transaction ID 0x8bdbd230
   87 2025-10-02 14:05:27.952734      0.0.0.0 → 255.255.255.255 DHCP 342 DHCP Request  - Transaction ID 0xb3b9cb59
   88 2025-10-02 14:05:28.567272      0.0.0.0 → 255.255.255.255 DHCP 342 DHCP Request  - Transaction ID 0x33fcdc63
   89 2025-10-02 14:05:28.669398      0.0.0.0 → 255.255.255.255 DHCP 342 DHCP Request  - Transaction ID 0x1d552722
   90 2025-10-02 14:05:29.079482      0.0.0.0 → 255.255.255.255 DHCP 342 DHCP Request  - Transaction ID 0x22091c49
   91 2025-10-02 14:05:29.900913      0.0.0.0 → 255.255.255.255 DHCP 342 DHCP Request  - Transaction ID 0xd2648312
   92 2025-10-02 14:05:30.615483      0.0.0.0 → 255.255.255.255 DHCP 342 DHCP Request  - Transaction ID 0x68e69949
   93 2025-10-02 14:05:30.717994      0.0.0.0 → 255.255.255.255 DHCP 342 DHCP Request  - Transaction ID 0xf946eb0d
   94 2025-10-02 14:05:31.331857      0.0.0.0 → 255.255.255.255 DHCP 342 DHCP Request  - Transaction ID 0x6163a43b
   95 2025-10-02 14:05:32.049044      0.0.0.0 → 255.255.255.255 DHCP 342 DHCP Request  - Transaction ID 0x69faf027
   96 2025-10-02 14:05:33.687500      0.0.0.0 → 255.255.255.255 DHCP 342 DHCP Request  - Transaction ID 0x9654797c
   97 2025-10-02 14:05:33.687504      0.0.0.0 → 255.255.255.255 DHCP 342 DHCP Request  - Transaction ID 0xc632ba2d
   98 2025-10-02 14:05:33.893358      0.0.0.0 → 255.255.255.255 DHCP 342 DHCP Request  - Transaction ID 0x25bde39b
   99 2025-10-02 14:05:33.893361      0.0.0.0 → 255.255.255.255 DHCP 342 DHCP Request  - Transaction ID 0xbea5bf0a
  100 2025-10-02 14:05:35.791050 156.143.52.93 → 10.102.52.47 TCP 78 64831 → 7000 [SYN] Seq=0 Win=65535 Len=0 MSS=1460 WS=64 TSval=3123179526 TSecr=0 SACK_PERM
  101 2025-10-02 14:05:36.791299 156.143.52.93 → 10.102.52.47 TCP 78 [TCP Retransmission] 64831 → 7000 [SYN] Seq=0 Win=65535 Len=0 MSS=1460 WS=64 TSval=3123180527 TSecr=0 SACK_PERM
  102 2025-10-02 14:05:37.069599      0.0.0.0 → 255.255.255.255 DHCP 342 DHCP Discover - Transaction ID 0xd09b3ea2
  103 2025-10-02 14:05:37.792524 156.143.52.93 → 10.102.52.47 TCP 78 [TCP Retransmission] 64831 → 7000 [SYN] Seq=0 Win=65535 Len=0 MSS=1460 WS=64 TSval=3123181528 TSecr=0 SACK_PERM
  104 2025-10-02 14:05:38.705164      0.0.0.0 → 255.255.255.255 DHCP 342 DHCP Request  - Transaction ID 0xd09b3ea2
  105 2025-10-02 14:05:38.793736 156.143.52.93 → 10.102.52.47 TCP 78 [TCP Retransmission] 64831 → 7000 [SYN] Seq=0 Win=65535 Len=0 MSS=1460 WS=64 TSval=3123182529 TSecr=0 SACK_PERM
  106 2025-10-02 14:05:39.013167      0.0.0.0 → 255.255.255.255 DHCP 360 DHCP Request  - Transaction ID 0x3cd8a2ca
  107 2025-10-02 14:05:39.795005 156.143.52.93 → 10.102.52.47 TCP 78 [TCP Retransmission] 64831 → 7000 [SYN] Seq=0 Win=65535 Len=0 MSS=1460 WS=64 TSval=3123183531 TSecr=0 SACK_PERM
  108 2025-10-02 14:05:39.933659      0.0.0.0 → 255.255.255.255 DHCP 342 DHCP Request  - Transaction ID 0xb6483a1
  109 2025-10-02 14:05:40.448151 23.223.44.237 → 156.143.52.93 TLSv1.2 90 Application Data
  110 2025-10-02 14:05:40.448154 23.223.44.237 → 156.143.52.93 TCP 66 443 → 57860 [FIN, ACK] Seq=25 Ack=1 Win=499 Len=0 TSval=100935635 TSecr=3027549988
  111 2025-10-02 14:05:40.448156 23.223.44.237 → 156.143.52.93 TCP 66 [TCP Retransmission] 443 → 57860 [FIN, ACK] Seq=25 Ack=1 Win=499 Len=0 TSval=100935657 TSecr=3027549988
  112 2025-10-02 14:05:40.448689 156.143.52.93 → 23.223.44.237 TCP 66 57860 → 443 [ACK] Seq=1 Ack=26 Win=2048 Len=0 TSval=3027670098 TSecr=100935635
  113 2025-10-02 14:05:40.451935 156.143.52.93 → 23.223.44.237 TCP 54 57860 → 443 [RST, ACK] Seq=1 Ack=26 Win=2048 Len=0
  114 2025-10-02 14:05:40.752991      0.0.0.0 → 255.255.255.255 DHCP 342 DHCP Request  - Transaction ID 0x9ac5038a
  115 2025-10-02 14:05:40.796274 156.143.52.93 → 10.102.52.47 TCP 78 [TCP Retransmission] 64831 → 7000 [SYN] Seq=0 Win=65535 Len=0 MSS=1460 WS=64 TSval=3123184532 TSecr=0 SACK_PERM
  116 2025-10-02 14:05:41.575442 23.207.52.22 → 156.143.52.93 TLSv1.2 90 Application Data
  117 2025-10-02 14:05:41.575446 23.207.52.22 → 156.143.52.93 TCP 66 443 → 57863 [FIN, ACK] Seq=25 Ack=1 Win=612 Len=0 TSval=2966116976 TSecr=3635166596
  118 2025-10-02 14:05:41.575447 23.207.52.22 → 156.143.52.93 TCP 66 [TCP Retransmission] 443 → 57863 [FIN, ACK] Seq=25 Ack=1 Win=612 Len=0 TSval=2966117002 TSecr=3635166596
  119 2025-10-02 14:05:41.575944 156.143.52.93 → 23.207.52.22 TCP 66 57863 → 443 [ACK] Seq=1 Ack=26 Win=2048 Len=0 TSval=3635286671 TSecr=2966116976
  120 2025-10-02 14:05:41.576584 156.143.52.93 → 23.207.52.22 TCP 54 57863 → 443 [RST, ACK] Seq=1 Ack=26 Win=2048 Len=0
  121 2025-10-02 14:05:41.985035 184.25.164.23 → 156.143.52.93 TLSv1.2 90 Application Data
  122 2025-10-02 14:05:41.985038 184.25.164.23 → 156.143.52.93 TCP 66 443 → 57867 [FIN, ACK] Seq=25 Ack=1 Win=660 Len=0 TSval=3984081419 TSecr=3598146042
  123 2025-10-02 14:05:41.985040 184.25.164.23 → 156.143.52.93 TCP 66 [TCP Retransmission] 443 → 57867 [FIN, ACK] Seq=25 Ack=1 Win=660 Len=0 TSval=3984081443 TSecr=3598146042
  124 2025-10-02 14:05:41.985831 156.143.52.93 → 184.25.164.23 TCP 66 57867 → 443 [ACK] Seq=1 Ack=26 Win=2048 Len=0 TSval=3598266224 TSecr=3984081419
  125 2025-10-02 14:05:41.986560 156.143.52.93 → 184.25.164.23 TCP 54 57867 → 443 [RST, ACK] Seq=1 Ack=26 Win=2048 Len=0
  126 2025-10-02 14:05:42.797523 156.143.52.93 → 10.102.52.47 TCP 78 [TCP Retransmission] 64831 → 7000 [SYN] Seq=0 Win=65535 Len=0 MSS=1460 WS=64 TSval=3123186533 TSecr=0 SACK_PERM
  127 2025-10-02 14:05:42.833439 208.103.161.2 → 156.143.52.93 TLSv1.2 91 Application Data
  128 2025-10-02 14:05:42.834120 156.143.52.93 → 208.103.161.2 TCP 66 57548 → 443 [ACK] Seq=88 Ack=105 Win=2048 Len=0 TSval=1148455489 TSecr=348402103
  129 2025-10-02 14:05:42.835821 156.143.52.93 → 208.103.161.2 TLSv1.2 95 Application Data
  130 2025-10-02 14:05:42.844256 208.103.161.2 → 156.143.52.93 TCP 66 443 → 57548 [ACK] Seq=105 Ack=117 Win=16 Len=0 TSval=348402115 TSecr=1148455492
  131 2025-10-02 14:05:42.941410 184.25.164.23 → 156.143.52.93 TLSv1.2 90 Application Data
  132 2025-10-02 14:05:42.941413 184.25.164.23 → 156.143.52.93 TCP 66 443 → 57869 [FIN, ACK] Seq=25 Ack=1 Win=540 Len=0 TSval=3984082482 TSecr=2114670047
  133 2025-10-02 14:05:42.941749 156.143.52.93 → 184.25.164.23 TCP 66 57869 → 443 [ACK] Seq=1 Ack=26 Win=2048 Len=0 TSval=2114790111 TSecr=3984082482
  134 2025-10-02 14:05:42.942185 156.143.52.93 → 184.25.164.23 TCP 54 57869 → 443 [RST, ACK] Seq=1 Ack=26 Win=2048 Len=0
  135 2025-10-02 14:05:44.542142      0.0.0.0 → 255.255.255.255 DHCP 342 DHCP Request  - Transaction ID 0xa9fce0d2
  136 2025-10-02 14:05:44.747170      0.0.0.0 → 255.255.255.255 DHCP 342 DHCP Request  - Transaction ID 0x198b80b5
  137 2025-10-02 14:05:45.463581      0.0.0.0 → 255.255.255.255 DHCP 342 DHCP Request  - Transaction ID 0xc632ba2e
  138 2025-10-02 14:05:45.610963 156.143.52.93 → 10.102.8.98  DNS 113 Standard query 0x0e44 HTTPS vmss-clarity-ingest-eus2-c.eastus2.cloudapp.azure.com
  139 2025-10-02 14:05:45.611142 156.143.52.93 → 10.102.8.98  DNS 113 Standard query 0xecee A vmss-clarity-ingest-eus2-c.eastus2.cloudapp.azure.com
  140 2025-10-02 14:05:45.621056  10.102.8.98 → 156.143.52.93 DNS 183 Standard query response 0x0e44 HTTPS vmss-clarity-ingest-eus2-c.eastus2.cloudapp.azure.com SOA ns1-06.azure-dns.com
  141 2025-10-02 14:05:45.626348  10.102.8.98 → 156.143.52.93 DNS 129 Standard query response 0xecee A vmss-clarity-ingest-eus2-c.eastus2.cloudapp.azure.com A 4.153.72.49
  142 2025-10-02 14:05:45.628926 156.143.52.93 → 4.153.72.49  TCP 78 57876 → 443 [SYN] Seq=0 Win=65535 Len=0 MSS=1460 WS=64 TSval=3841413846 TSecr=0 SACK_PERM
  143 2025-10-02 14:05:45.647755  4.153.72.49 → 156.143.52.93 TCP 74 443 → 57876 [SYN, ACK] Seq=0 Ack=1 Win=65160 Len=0 MSS=1440 SACK_PERM TSval=2512606281 TSecr=3841413846 WS=128
  144 2025-10-02 14:05:45.648676 156.143.52.93 → 4.153.72.49  TCP 66 57876 → 443 [ACK] Seq=1 Ack=1 Win=131392 Len=0 TSval=3841413866 TSecr=2512606281
  145 2025-10-02 14:05:45.648680 156.143.52.93 → 4.153.72.49  TLSv1 583 Client Hello (SNI=i.clarity.ms)
  146 2025-10-02 14:05:45.665518  4.153.72.49 → 156.143.52.93 TCP 66 443 → 57876 [ACK] Seq=1 Ack=518 Win=64768 Len=0 TSval=2512606300 TSecr=3841413866
  147 2025-10-02 14:05:45.665522  4.153.72.49 → 156.143.52.93 TCP 66 [TCP Dup ACK 146#1] 443 → 57876 [ACK] Seq=1 Ack=518 Win=64768 Len=0 TSval=2512606300 TSecr=3841413866
  148 2025-10-02 14:05:45.668402  4.153.72.49 → 156.143.52.93 TLSv1.2 1514 Server Hello
  149 2025-10-02 14:05:45.668405  4.153.72.49 → 156.143.52.93 TCP 1514 443 → 57876 [PSH, ACK] Seq=1449 Ack=518 Win=64768 Len=1448 TSval=2512606301 TSecr=3841413866
  150 2025-10-02 14:05:45.668409  4.153.72.49 → 156.143.52.93 TCP 1266 443 → 57876 [PSH, ACK] Seq=2897 Ack=518 Win=64768 Len=1200 TSval=2512606301 TSecr=3841413866
  151 2025-10-02 14:05:45.668412  4.153.72.49 → 156.143.52.93 TLSv1.2 1279 Certificate, Server Key Exchange, Server Hello Done
  152 2025-10-02 14:05:45.669280 156.143.52.93 → 4.153.72.49  TCP 66 57876 → 443 [ACK] Seq=518 Ack=5310 Win=126144 Len=0 TSval=3841413886 TSecr=2512606302
  153 2025-10-02 14:05:45.669285 156.143.52.93 → 4.153.72.49  TCP 66 [TCP Window Update] 57876 → 443 [ACK] Seq=518 Ack=5310 Win=131072 Len=0 TSval=3841413886 TSecr=2512606302
  154 2025-10-02 14:05:45.675961 156.143.52.93 → 4.153.72.49  TLSv1.2 159 Client Key Exchange, Change Cipher Spec, Encrypted Handshake Message
  155 2025-10-02 14:05:45.677686 156.143.52.93 → 4.153.72.49  TLSv1.2 593 Application Data
  156 2025-10-02 14:05:45.677886 156.143.52.93 → 4.153.72.49  TLSv1.2 302 Application Data
  157 2025-10-02 14:05:45.692477  4.153.72.49 → 156.143.52.93 TLSv1.2 117 Change Cipher Spec, Encrypted Handshake Message
  158 2025-10-02 14:05:45.693060 156.143.52.93 → 4.153.72.49  TCP 66 57876 → 443 [ACK] Seq=1374 Ack=5361 Win=131072 Len=0 TSval=3841413910 TSecr=2512606327
  159 2025-10-02 14:05:45.694726  4.153.72.49 → 156.143.52.93 TCP 66 443 → 57876 [ACK] Seq=5361 Ack=1374 Win=64128 Len=0 TSval=2512606330 TSecr=3841413895
  160 2025-10-02 14:05:45.696279  4.153.72.49 → 156.143.52.93 TLSv1.2 380 Application Data
  161 2025-10-02 14:05:45.696671 156.143.52.93 → 4.153.72.49  TCP 66 57876 → 443 [ACK] Seq=1374 Ack=5675 Win=130816 Len=0 TSval=3841413914 TSecr=2512606331
  162 2025-10-02 14:05:46.077702      0.0.0.0 → 255.255.255.255 DHCP 364 DHCP Request  - Transaction ID 0xf9236dbd
  163 2025-10-02 14:05:46.794541      0.0.0.0 → 255.255.255.255 DHCP 342 DHCP Request  - Transaction ID 0x542db98f
  164 2025-10-02 14:05:47.204343      0.0.0.0 → 255.255.255.255 DHCP 342 DHCP Request  - Transaction ID 0x5c5fd30d
  165 2025-10-02 14:05:49.154217 17.248.186.105 → 156.143.52.93 TLSv1.2 105 Application Data
  166 2025-10-02 14:05:49.154220 17.248.186.105 → 156.143.52.93 TLSv1.2 90 Application Data
  167 2025-10-02 14:05:49.154222 17.248.186.105 → 156.143.52.93 TCP 66 443 → 57859 [FIN, ACK] Seq=274 Ack=154 Win=355 Len=0 TSval=2941810687 TSecr=3222563424
  168 2025-10-02 14:05:49.157266 156.143.52.93 → 17.248.186.105 TCP 66 57859 → 443 [ACK] Seq=154 Ack=275 Win=3044 Len=0 TSval=3222593465 TSecr=2941810687
  169 2025-10-02 14:05:49.161465 156.143.52.93 → 17.248.186.105 TLSv1.2 101 Application Data
  170 2025-10-02 14:05:49.161616 156.143.52.93 → 17.248.186.105 TCP 54 57859 → 443 [RST, ACK] Seq=189 Ack=275 Win=3044 Len=0
  171 2025-10-02 14:05:49.170182 17.248.186.105 → 156.143.52.93 TCP 66 443 → 57859 [ACK] Seq=275 Ack=189 Win=355 Len=0 TSval=2941810735 TSecr=3222593472
  172 2025-10-02 14:05:49.170292 156.143.52.93 → 17.248.186.105 TCP 54 57859 → 443 [RST] Seq=189 Win=0 Len=0
  173 2025-10-02 14:05:50.686274 156.143.62.30 → 156.143.63.255 UDP 82 57621 → 57621 Len=40
  174 2025-10-02 14:05:50.788635      0.0.0.0 → 255.255.255.255 DHCP 342 DHCP Request  - Transaction ID 0x7c072e19
  175 2025-10-02 14:05:51.915126      0.0.0.0 → 255.255.255.255 DHCP 342 DHCP Request  - Transaction ID 0x8fd1547f
  176 2025-10-02 14:05:53.860629      0.0.0.0 → 255.255.255.255 DHCP 342 DHCP Request  - Transaction ID 0x7925ff37
  177 2025-10-02 14:05:53.965678 Fortinet_d4:84:14 → e6:72:49:f1:ba:ae ARP 60 Who has 156.143.52.93? Tell 156.143.48.8
  178 2025-10-02 14:05:53.965826 e6:72:49:f1:ba:ae → Fortinet_d4:84:14 ARP 42 156.143.52.93 is at e6:72:49:f1:ba:ae
  179 2025-10-02 14:05:55.296526  4.153.72.49 → 156.143.52.93 TLSv1.2 97 Encrypted Alert
  180 2025-10-02 14:05:55.296529  4.153.72.49 → 156.143.52.93 TCP 66 443 → 57876 [FIN, ACK] Seq=5706 Ack=1374 Win=64128 Len=0 TSval=2512615903 TSecr=3841413914
  181 2025-10-02 14:05:55.297057 156.143.52.93 → 4.153.72.49  TCP 66 57876 → 443 [ACK] Seq=1374 Ack=5707 Win=131072 Len=0 TSval=3841423515 TSecr=2512615903
  182 2025-10-02 14:05:55.297313 156.143.52.93 → 4.153.72.49  TCP 54 57876 → 443 [RST, ACK] Seq=1374 Ack=5707 Win=131072 Len=0
  183 2025-10-02 14:05:55.311456  4.153.72.49 → 156.143.52.93 TCP 66 [TCP Retransmission] 443 → 57876 [FIN, ACK] Seq=5706 Ack=1374 Win=64128 Len=0 TSval=2512615947 TSecr=3841413914
  184 2025-10-02 14:05:55.311580 156.143.52.93 → 4.153.72.49  TCP 54 57876 → 443 [RST] Seq=1374 Win=0 Len=0
  185 2025-10-02 14:05:56.628167 208.103.161.2 → 156.143.52.93 TLSv1.2 120 Application Data
  186 2025-10-02 14:05:56.628813 156.143.52.93 → 208.103.161.2 TCP 66 57548 → 443 [ACK] Seq=117 Ack=159 Win=2048 Len=0 TSval=1148469284 TSecr=348415807
  187 2025-10-02 14:05:56.630817 156.143.52.93 → 208.103.161.2 TLSv1.2 124 Application Data
  188 2025-10-02 14:05:56.639213 208.103.161.2 → 156.143.52.93 TCP 66 443 → 57548 [ACK] Seq=159 Ack=175 Win=16 Len=0 TSval=348415910 TSecr=1148469287
  189 2025-10-02 14:05:56.889410 156.143.52.93 → 18.97.36.18  TLSv1.2 307 Application Data
  190 2025-10-02 14:05:56.915306  18.97.36.18 → 156.143.52.93 TLSv1.2 185 Application Data
  191 2025-10-02 14:05:56.915879 156.143.52.93 → 18.97.36.18  TCP 66 57664 → 443 [ACK] Seq=484 Ack=238 Win=2047 Len=0 TSval=3723015065 TSecr=61876734
  192 2025-10-02 14:05:57.700623 Fortinet_d4:84:14 → e6:72:49:f1:ba:ae ARP 60 156.143.48.8 is at 08:5b:0e:d4:84:14
  193 2025-10-02 14:05:58.059051      0.0.0.0 → 255.255.255.255 DHCP 342 DHCP Request  - Transaction ID 0x3beff91a
  194 2025-10-02 14:05:59.564177 e6:72:49:f1:ba:ae → Broadcast    ARP 42 Who has 169.254.169.254? Tell 156.143.52.93
  195 2025-10-02 14:06:00.209403      0.0.0.0 → 255.255.255.255 DHCP 342 DHCP Request  - Transaction ID 0x69faf028
  196 2025-10-02 14:06:00.564225 e6:72:49:f1:ba:ae → Broadcast    ARP 42 Who has 169.254.169.254? Tell 156.143.52.93
  197 2025-10-02 14:06:00.823742      0.0.0.0 → 255.255.255.255 DHCP 342 DHCP Request  - Transaction ID 0x33fcdc65
  198 2025-10-02 14:06:01.028711      0.0.0.0 → 255.255.255.255 DHCP 342 DHCP Request  - Transaction ID 0x48076833
  199 2025-10-02 14:06:01.233387      0.0.0.0 → 255.255.255.255 DHCP 342 DHCP Request  - Transaction ID 0x5dada13
  200 2025-10-02 14:06:01.335865      0.0.0.0 → 255.255.255.255 DHCP 342 DHCP Request  - Transaction ID 0x9c761422
  201 2025-10-02 14:06:01.565479 e6:72:49:f1:ba:ae → Broadcast    ARP 42 Who has 169.254.169.254? Tell 156.143.52.93
  202 2025-10-02 14:06:02.668876      0.0.0.0 → 255.255.255.255 DHCP 342 DHCP Request  - Transaction ID 0x2166dbd7
  203 2025-10-02 14:06:02.770421      0.0.0.0 → 255.255.255.255 DHCP 342 DHCP Request  - Transaction ID 0x13d8c43b
  204 2025-10-02 14:06:02.974367      0.0.0.0 → 255.255.255.255 DHCP 342 DHCP Request  - Transaction ID 0x2b2688d0
  205 2025-10-02 14:06:03.486652      0.0.0.0 → 255.255.255.255 DHCP 342 DHCP Request  - Transaction ID 0xa9fce0d3
  206 2025-10-02 14:06:04.817594      0.0.0.0 → 255.255.255.255 DHCP 342 DHCP Request  - Transaction ID 0x7f341523
  207 2025-10-02 14:06:06.353615      0.0.0.0 → 255.255.255.255 DHCP 342 DHCP Request  - Transaction ID 0xdfcebab3
  208 2025-10-02 14:06:06.967745      0.0.0.0 → 255.255.255.255 DHCP 342 DHCP Request  - Transaction ID 0x751b2d82
  209 2025-10-02 14:06:07.173649      0.0.0.0 → 255.255.255.255 DHCP 342 DHCP Request  - Transaction ID 0x85027f2b
